{
  "schema": "nesttrace.tracks",
  "version": 1,
  "tracks": [
    {
      "id": "track-1",
      "pin_id": "pin-3",
      "points": [
        [
          4.5,
          -7.631,
          -6.334
        ],
        [
          4.75,
          -7.556,
          -6.462
        ],
        [
          5,
          -7.714,
          -6.671
        ],
        [
          5.375,
          -7.557,
          -6.385
        ],
        [
          5.625,
          -7.462,
          -6.476
        ],
        [
          5.875,
          -7.37,
          -6.122
        ],
        [
          6.125,
          -7.233,
          -6.649
        ],
        [
          6.375,
          -7.172,
          -6.08
        ],
        [
          6.625,
          -7.051,
          -5.837
        ],
        [
          6.875,
          -6.976,
          -5.657
        ],
        [
          7.125,
          -6.803,
          -6.013
        ],
        [
          7.375,
          -6.762,
          -5.414
        ],
        [
          7.625,
          -6.646,
          -5.393
        ],
        [
          7.875,
          -6.547,
          -5.121
        ],
        [
          8.125,
          -6.377,
          -5.45
        ],
        [
          8.375,
          -6.273,
          -5.131
        ],
        [
          8.625,
          -6.227,
          -4.891
        ],
        [
          8.875,
          -6.155,
          -4.661
        ],
        [
          9.125,
          -6.013,
          -4.868
        ],
        [
          9.375,
          -6.004,
          -4.779
        ],
        [
          9.625,
          -5.997,
          -4.276
        ],
        [
          9.875,
          -5.951,
          -3.337
        ],
        [
          10.125,
          -5.816,
          -3.134
        ],
        [
          10.375,
          -5.8,
          -2.69
        ],
        [
          10.625,
          -6.079,
          -2.447
        ],
        [
          10.875,
          -6.017,
          -1.836
        ],
        [
          11.125,
          -5.679,
          -1.048
        ],
        [
          11.375,
          -5.644,
          -0.507
        ],
        [
          11.625,
          -6.415,
          -0.509
        ],
        [
          11.875,
          -6.373,
          -0.089
        ],
        [
          12.125,
          -6.425,
          0.253
        ],
        [
          12.375,
          -6.516,
          0.467
        ],
        [
          12.625,
          -6.603,
          0.269
        ],
        [
          12.875,
          -6.45,
          0.93
        ],
        [
          13.125,
          -5.835,
          1.274
        ],
        [
          13.5,
          -6.113,
          1.008
        ],
        [
          14,
          -6.528,
          1.412
        ],
        [
          14.625,
          -6.167,
          1.934
        ],
        [
          15,
          -5.168,
          1.102
        ],
        [
          15.375,
          -5.225,
          0.963
        ]
      ]
    },
    {
      "id": "track-2",
      "pin_id": "pin-1",
      "points": [
        [
          7.625,
          -9.792,
          -7.805
        ],
        [
          7.875,
          -10.328,
          -7.686
        ],
        [
          8.125,
          -10.409,
          -7.484
        ],
        [
          8.375,
          -10.202,
          -7.147
        ],
        [
          8.625,
          -10.316,
          -6.829
        ],
        [
          8.875,
          -10.677,
          -6.702
        ],
        [
          9.125,
          -10.471,
          -6.15
        ],
        [
          9.375,
          -10.456,
          -5.698
        ],
        [
          9.625,
          -10.568,
          -4.868
        ],
        [
          10,
          -10.305,
          -4.218
        ],
        [
          10.25,
          -10.183,
          -3.689
        ],
        [
          10.5,
          -10.202,
          -3.229
        ],
        [
          10.75,
          -10.294,
          -2.799
        ],
        [
          11,
          -10.239,
          -2.241
        ],
        [
          11.25,
          -10.247,
          -1.971
        ],
        [
          11.5,
          -10.258,
          -1.562
        ],
        [
          11.75,
          -10.233,
          -1.136
        ],
        [
          12,
          -10.455,
          -0.941
        ],
        [
          12.25,
          -10.311,
          -0.59
        ],
        [
          12.5,
          -10.517,
          -0.536
        ],
        [
          12.75,
          -10.466,
          -0.39
        ],
        [
          13,
          -10.37,
          -0.111
        ],
        [
          13.25,
          -10.559,
          -0.121
        ],
        [
          13.375,
          -10.587,
          0.434
        ]
      ]
    },
    {
      "id": "track-3",
      "pin_id": "pin-6",
      "points": [
        [
          10.25,
          -1.826,
          -7.892
        ],
        [
          10.5,
          -1.825,
          -7.563
        ],
        [
          10.75,
          -1.9,
          -7.202
        ],
        [
          11,
          -2.003,
          -6.933
        ],
        [
          11.25,
          -1.977,
          -6.48
        ],
        [
          11.5,
          -1.946,
          -6.062
        ],
        [
          11.75,
          -2.017,
          -5.501
        ],
        [
          12,
          -2.087,
          -4.882
        ],
        [
          12.25,
          -2.142,
          -4.188
        ],
        [
          12.5,
          -2.092,
          -3.544
        ],
        [
          12.75,
          -2.19,
          -2.999
        ],
        [
          13,
          -2.236,
          -2.344
        ],
        [
          13.25,
          -2.165,
          -1.821
        ],
        [
          13.5,
          -2.078,
          -1.282
        ],
        [
          13.75,
          -2.134,
          -0.87
        ],
        [
          14,
          -2.083,
          -0.391
        ],
        [
          14.25,
          -2.028,
          -0.081
        ],
        [
          14.5,
          -2.076,
          0.297
        ],
        [
          14.75,
          -2.106,
          0.54
        ],
        [
          15,
          -2.08,
          0.732
        ],
        [
          15.25,
          -2.053,
          1.007
        ],
        [
          15.5,
          -2.262,
          0.676
        ],
        [
          15.75,
          -2.262,
          0.114
        ],
        [
          16,
          -2.159,
          -0.081
        ],
        [
          16.25,
          -2.848,
          0.076
        ],
        [
          16.5,
          -2.072,
          -0.662
        ],
        [
          16.75,
          -3.032,
          -0.816
        ],
        [
          17.375,
          -3.346,
          -0.134
        ],
        [
          18,
          -3.52,
          -0.862
        ],
        [
          18.375,
          -3.436,
          0.021
        ],
        [
          19,
          -3.208,
          -0.202
        ]
      ]
    },
    {
      "id": "track-4",
      "pin_id": "pin-5",
      "points": [
        [
          12,
          2.353,
          -7.902
        ],
        [
          12.25,
          1.749,
          -7.671
        ],
        [
          12.5,
          1.737,
          -7.469
        ],
        [
          12.75,
          1.835,
          -7.102
        ],
        [
          13,
          1.854,
          -6.873
        ],
        [
          13.25,
          1.81,
          -6.542
        ],
        [
          13.5,
          1.792,
          -6.177
        ],
        [
          13.75,
          1.849,
          -5.727
        ],
        [
          14,
          1.881,
          -5.239
        ],
        [
          14.25,
          1.793,
          -4.646
        ],
        [
          14.5,
          1.829,
          -4.046
        ],
        [
          14.75,
          1.895,
          -3.603
        ],
        [
          15,
          1.811,
          -3.045
        ],
        [
          15.25,
          1.789,
          -2.606
        ],
        [
          15.5,
          1.808,
          -2.162
        ],
        [
          15.75,
          1.9,
          -1.875
        ],
        [
          16,
          1.808,
          -1.459
        ],
        [
          16.25,
          1.788,
          -1.113
        ],
        [
          16.5,
          1.834,
          -0.885
        ],
        [
          16.75,
          1.836,
          -0.571
        ],
        [
          17,
          1.82,
          -0.428
        ],
        [
          17.25,
          1.822,
          -0.442
        ],
        [
          17.5,
          2.366,
          0.229
        ],
        [
          17.75,
          2.237,
          0.018
        ],
        [
          18.25,
          3.022,
          -0.535
        ],
        [
          18.875,
          2.726,
          0.117
        ],
        [
          19.125,
          2.7,
          -0.417
        ],
        [
          19.375,
          3.272,
          -0.728
        ],
        [
          19.625,
          2.767,
          -0.331
        ],
        [
          19.875,
          3.006,
          -0.45
        ],
        [
          20.125,
          2.661,
          0.192
        ],
        [
          20.5,
          2.433,
          -0.032
        ],
        [
          20.75,
          2.88,
          -0.153
        ],
        [
          21,
          2.98,
          -0.065
        ],
        [
          21.25,
          2.686,
          -0.02
        ],
        [
          21.625,
          3.396,
          0.098
        ],
        [
          21.875,
          2.825,
          -0.682
        ],
        [
          22,
          3.034,
          -0.887
        ]
      ]
    },
    {